{
  "uxVersion": "capability-ux.v1",
  "uxId": "hello-world",
  "title": "Hello World input and outcome",
  "note": "The smallest complete case: no editable field at all. Every value is server-owned, so the dialog is an explicit Run and nothing else. It exists to prove that a capability with no user input still gets a real generated dialog rather than a special case.",
  "subject": "say-hello-world",
  "pins": {
    "publicationId": "sha256:2f43afdafdf734303c449cab844ad0a0dddc3c5d5645178fe3b004e6e547b304",
    "inputContract": "hello-world-request.v1",
    "inputSchemaDigest": "sha256:0cb0cff2850d0636dd684850c859b4216e4b65e3ebb1f646fcb7c34771a08eb0",
    "outcomeSchemaDigests": {
      "hello-world-greeting.v1": "sha256:032a564e36eb1123f46c112386f96eded1a50c074537eb5e0f40c8beb7ba83c8"
    }
  },
  "input": {
    "dialogTitle": "Enter Capability Input",
    "description": "No input is required. The contract and payload are server-owned.",
    "anchor": {
      "kind": "scene-node",
      "nodeIdentity": "cell:scenario:say-hello-world:input",
      "fallback": "viewport-transition"
    },
    "intents": {
      "submit": {
        "label": "Submit",
        "actionId": "submit-hello-world",
        "scenarioEvent": "workbench.capability.submitted",
        "presentationIntent": "primary-action"
      },
      "cancel": {
        "label": "Cancel",
        "actionId": "cancel-hello-world",
        "scenarioEvent": "workbench.capability.cancelled",
        "presentationIntent": "secondary-action"
      }
    }
  },
  "outcomes": [
    {
      "outcomeId": "greeting",
      "contract": "hello-world-greeting.v1",
      "dialogTitle": "Capability outcome",
      "match": {
        "contractId": "hello-world-greeting.v1"
      },
      "anchor": {
        "kind": "scene-node",
        "nodeIdentity": "cell:scenario:say-hello-world:outcome",
        "fallback": "viewport-transition"
      },
      "layout": [
        {
          "elementId": "message",
          "family": "text",
          "label": "Greeting",
          "pointer": "/payload/message"
        }
      ]
    }
  ],
  "delivery": {
    "refusedTitle": "Request refused",
    "uncertainTitle": "Delivery uncertain",
    "uncertainGuidance": "The request was sent but its outcome is not established. It is retained for reconciliation and is not resubmitted automatically."
  },
  "motion": {
    "open": "expand-from-anchor",
    "close": "collapse-to-anchor",
    "reducedMotionFallback": "none"
  }
}
